{
  "ide": "copilot-cli",
  "version": "1.0.82-1",
  "release_date": "2026-08-28",
  "title": "1.0.82-1",
  "url": "https://github.com/github/copilot-cli/releases/tag/v1.0.82-1",
  "source": "api",
  "body_markdown": "**Fixed**\n- Show the specific authentication failure (such as 401 Bad credentials) instead of only the /login prompt",
  "body_html": null,
  "categories": [],
  "copilot_mentions": [
    "**Fixed**",
    "- Show the specific authentication failure (such as 401 Bad credentials) instead of only the /login prompt"
  ],
  "prerelease": true,
  "fetched_at": "2026-08-28T19:23:42Z",
  "schema_version": 1
}
