{
  "ide": "copilot-cli",
  "version": "1.0.44",
  "release_date": "2026-05-08",
  "title": "1.0.44",
  "url": "https://github.com/github/copilot-cli/releases/tag/v1.0.44",
  "source": "api",
  "body_markdown": "2026-05-08\n\n- Path completion in /add-dir no longer flickers or gets intercepted by @ and # pickers\n- Slash commands can now appear mid-input, and multiple skills can be invoked in a single message\n- userPromptSubmitted hooks can now handle requests directly, bypassing the LLM and returning a response without making a model call\n- Faster /user list and /user switch for multi-account users\n- Add optional `prerelease` argument to `copilot update` and `/update` to fetch the latest prerelease build\n- Shell commands via ! prefix work correctly with all shell configurations\n- Shell aliases and rc file settings now work in ! commands\n- Quota display correctly shows remaining usage for Free users instead of always showing 100% used\n- Tool permissions granted in autopilot mode are preserved after /clear\n- Effort level applies correctly when switching models via the /model picker\n- Pressing Ctrl+C while a permission prompt is pending no longer causes the CLI to hang\n- Project info remains visible in slash command picker when no results match\n- Invalid URL entries in settings.json no longer crash CLI startup and are skipped with a warning\n- Timeline shows the resolved model for rubber-duck sub-agents (e.g. Rubber-duck(claude-opus-4.7))",
  "body_html": null,
  "categories": [],
  "copilot_mentions": [
    "2026-05-08",
    "- Path completion in /add-dir no longer flickers or gets intercepted by @ and # pickers",
    "- Slash commands can now appear mid-input, and multiple skills can be invoked in a single message",
    "- userPromptSubmitted hooks can now handle requests directly, bypassing the LLM and returning a response without making a model call",
    "- Faster /user list and /user switch for multi-account users",
    "- Add optional `prerelease` argument to `copilot update` and `/update` to fetch the latest prerelease build",
    "- Shell commands via ! prefix work correctly with all shell configurations",
    "- Shell aliases and rc file settings now work in ! commands",
    "- Quota display correctly shows remaining usage for Free users instead of always showing 100% used",
    "- Tool permissions granted in autopilot mode are preserved after /clear",
    "- Effort level applies correctly when switching models via the /model picker",
    "- Pressing Ctrl+C while a permission prompt is pending no longer causes the CLI to hang",
    "- Project info remains visible in slash command picker when no results match",
    "- Invalid URL entries in settings.json no longer crash CLI startup and are skipped with a warning",
    "- Timeline shows the resolved model for rubber-duck sub-agents (e.g. Rubber-duck(claude-opus-4.7))"
  ],
  "prerelease": false,
  "fetched_at": "2026-06-02T17:01:24Z",
  "schema_version": 1
}
