{
  "ide": "copilot-cli",
  "version": "1.0.104-1",
  "release_date": "2026-10-23",
  "title": "1.0.104-1",
  "url": "https://github.com/github/copilot-cli/releases/tag/v1.0.104-1",
  "source": "api",
  "body_markdown": "Fixes and changes",
  "body_html": null,
  "categories": [],
  "copilot_mentions": [
    "Fixes and changes"
  ],
  "prerelease": true,
  "fetched_at": "2026-10-24T11:57:39Z",
  "schema_version": 1
}