{
  "ide": "copilot-cli",
  "version": "0.0.417",
  "release_date": "2026-02-25",
  "title": "0.0.417",
  "url": "https://github.com/github/copilot-cli/releases/tag/v0.0.417",
  "source": "api",
  "body_markdown": "2026-02-25\n\n- Add /research command for deep research with exportable reports\n- MCP servers no longer intermittently fail to load when opening a new session\n- Plugin agents and skills are available immediately after install without restarting\n- Plugin skills and commands load from custom paths declared in plugin.json\n- Alt+backspace correctly registers as backspace instead of delete",
  "body_html": null,
  "categories": [],
  "copilot_mentions": [
    "2026-02-25",
    "- Add /research command for deep research with exportable reports",
    "- MCP servers no longer intermittently fail to load when opening a new session",
    "- Plugin agents and skills are available immediately after install without restarting",
    "- Plugin skills and commands load from custom paths declared in plugin.json",
    "- Alt+backspace correctly registers as backspace instead of delete"
  ],
  "prerelease": false,
  "fetched_at": "2026-06-02T17:01:24Z",
  "schema_version": 1
}
