{
  "ide": "visual-studio-2022",
  "version": "17.14.34",
  "release_date": "2026-06-09",
  "title": "Version 17.14.34",
  "url": "https://learn.microsoft.com/en-us/visualstudio/releases/2022/release-notes",
  "source": "html",
  "body_markdown": "*Released June 9th, 2026*\n\n| Top bug fixes | From the community |\n| --- | --- |\n| Fix for GitHub Copilot not fetching functions saved to prompt | [Feedback ticket](https://developercommunity.visualstudio.com/t/Using-GitHub-Copilot-now-can-no-longer-s/11049933) |\n\n| Security advisories addressed | CVE | Description |\n| --- | --- | --- |\n| SQLite Memory Corruption Vulnerability | [CVE-2025-6965](https://msrc.microsoft.com/update-guide/vulnerability/CVE-2025-6965) | There exists a vulnerability in SQLite versions before 3.50.2 where the number of aggregate terms could exceed the number of columns available. This could lead to a memory corruption issue. |\n| .NET SDK Elevation of Privilege Vulnerability | [CVE-2026-45490](https://msrc.microsoft.com/update-guide/vulnerability/CVE-2026-45490) | dotnet.exe workload elevate - Arbitrary file creation/truncation via LogFile named pipe allows an unauthorized attacker to elevate privileges locally. |\n| .NET Core Tampering Vulnerability | [CVE-2026-45491](https://msrc.microsoft.com/update-guide/vulnerability/CVE-2026-45491) | Symlink path traversal in System.Formats.Tar enables arbitrary file write when extracting tar entries. |\n| ASP.NET Core Denial of Service Vulnerability | [CVE-2026-45591](https://msrc.microsoft.com/update-guide/vulnerability/CVE-2026-45591) | Stack overflow DoS via deeply-nested MessagePack arrays in SignalR and Blazor Server. |",
  "body_html": "<p><em>Released June 9<sup>th</sup>, 2026</em></p>\n<table>\n<thead>\n<tr>\n<th style=\"text-align: left;\">Top bug fixes</th>\n<th style=\"text-align: right;\">From the community</th>\n</tr>\n</thead>\n<tbody>\n<tr>\n<td style=\"text-align: left;\">Fix for GitHub Copilot not fetching functions saved to prompt</td>\n<td style=\"text-align: right;\"><a data-linktype=\"external\" href=\"https://developercommunity.visualstudio.com/t/Using-GitHub-Copilot-now-can-no-longer-s/11049933\">Feedback ticket</a></td>\n</tr>\n</tbody>\n</table>\n<table>\n<thead>\n<tr>\n<th style=\"text-align: left;\">Security advisories addressed</th>\n<th style=\"text-align: left;\">CVE</th>\n<th style=\"text-align: left;\">Description</th>\n</tr>\n</thead>\n<tbody>\n<tr>\n<td style=\"text-align: left;\">SQLite Memory Corruption Vulnerability</td>\n<td style=\"text-align: left;\"><a data-linktype=\"external\" href=\"https://msrc.microsoft.com/update-guide/vulnerability/CVE-2025-6965\">CVE-2025-6965</a></td>\n<td style=\"text-align: left;\">There exists a vulnerability in SQLite versions before 3.50.2 where the number of aggregate terms could exceed the number of columns available. This could lead to a memory corruption issue.</td>\n</tr>\n<tr>\n<td style=\"text-align: left;\">.NET SDK Elevation of Privilege Vulnerability</td>\n<td style=\"text-align: left;\"><a data-linktype=\"external\" href=\"https://msrc.microsoft.com/update-guide/vulnerability/CVE-2026-45490\">CVE-2026-45490</a></td>\n<td style=\"text-align: left;\">dotnet.exe workload elevate - Arbitrary file creation/truncation via LogFile named pipe allows an unauthorized attacker to elevate privileges locally.</td>\n</tr>\n<tr>\n<td style=\"text-align: left;\">.NET Core Tampering Vulnerability</td>\n<td style=\"text-align: left;\"><a data-linktype=\"external\" href=\"https://msrc.microsoft.com/update-guide/vulnerability/CVE-2026-45491\">CVE-2026-45491</a></td>\n<td style=\"text-align: left;\">Symlink path traversal in System.Formats.Tar enables arbitrary file write when extracting tar entries.</td>\n</tr>\n<tr>\n<td style=\"text-align: left;\">ASP.NET Core Denial of Service Vulnerability</td>\n<td style=\"text-align: left;\"><a data-linktype=\"external\" href=\"https://msrc.microsoft.com/update-guide/vulnerability/CVE-2026-45591\">CVE-2026-45591</a></td>\n<td style=\"text-align: left;\">Stack overflow DoS via deeply-nested MessagePack arrays in SignalR and Blazor Server.</td>\n</tr>\n</tbody>\n</table>",
  "categories": [],
  "copilot_mentions": [
    "| Fix for GitHub Copilot not fetching functions saved to prompt | [Feedback ticket](https://developercommunity.visualstudio.com/t/Using-GitHub-Copilot-now-can-no-longer-s/11049933) |"
  ],
  "fetched_at": "2026-06-16T08:38:27Z",
  "schema_version": 1
}