{
  "ide": "visual-studio-2022",
  "version": "17.13.5",
  "release_date": "2025-03-25",
  "title": "Version 17.13.5",
  "url": "https://learn.microsoft.com/en-us/visualstudio/releases/2022/release-notes-v17.13",
  "source": "html",
  "body_markdown": "*Released March 25th, 2025*\n\n| Top bug fixes | From the community |\n| --- | --- |\n| Visual Studio 17.13.3 Startup Project Toolbar no longer visible | [Feedback ticket](https://developercommunity.visualstudio.com/t/Visual-Studio-17133-Startup-Project-To/10869129) |\n| Visual Studio use wrong parameters when launching services with multi-launch profile | [Feedback ticket](https://developercommunity.visualstudio.com/t/Visual-Studio-use-wrong-parameters-when-/10868757) |\n| Visual Studio removes version in .feature definition, it's not possible to build correct WSP | [Feedback ticket](https://developercommunity.visualstudio.com/t/Visual-Studio-removes-version-in-featur/10867853) |\n| C# editor pressing CTRL+BACKSPACE to erase a word causes an error dialog to appear when the word is an unclosed \" | [Feedback ticket](https://developercommunity.visualstudio.com/t/C-editor-pressing-CTRLBACKSPACE-to-era/10862565) |",
  "body_html": "<p><em>Released March 25<sup>th</sup>, 2025</em></p>\n<table>\n<thead>\n<tr>\n<th style=\"text-align: left;\">Top bug fixes</th>\n<th style=\"text-align: right;\">From the community</th>\n</tr>\n</thead>\n<tbody>\n<tr>\n<td style=\"text-align: left;\">Visual Studio 17.13.3 Startup Project Toolbar no longer visible</td>\n<td style=\"text-align: right;\"><a data-linktype=\"external\" href=\"https://developercommunity.visualstudio.com/t/Visual-Studio-17133-Startup-Project-To/10869129\">Feedback ticket</a></td>\n</tr>\n<tr>\n<td style=\"text-align: left;\">Visual Studio use wrong parameters when launching services with multi-launch profile</td>\n<td style=\"text-align: right;\"><a data-linktype=\"external\" href=\"https://developercommunity.visualstudio.com/t/Visual-Studio-use-wrong-parameters-when-/10868757\">Feedback ticket</a></td>\n</tr>\n<tr>\n<td style=\"text-align: left;\">Visual Studio removes version in .feature definition, it's not possible to build correct WSP</td>\n<td style=\"text-align: right;\"><a data-linktype=\"external\" href=\"https://developercommunity.visualstudio.com/t/Visual-Studio-removes-version-in-featur/10867853\">Feedback ticket</a></td>\n</tr>\n<tr>\n<td style=\"text-align: left;\">C# editor pressing CTRL+BACKSPACE to erase a word causes an error dialog to appear when the word is an unclosed \"</td>\n<td style=\"text-align: right;\"><a data-linktype=\"external\" href=\"https://developercommunity.visualstudio.com/t/C-editor-pressing-CTRLBACKSPACE-to-era/10862565\">Feedback ticket</a></td>\n</tr>\n</tbody>\n</table>",
  "categories": [],
  "copilot_mentions": [],
  "fetched_at": "2026-05-15T19:10:40Z",
  "schema_version": 1
}