{
  "ide": "visual-studio-2022",
  "version": "17.9.2",
  "release_date": "2024-02-27",
  "title": "Visual Studio 2022 version 17.9.2",
  "url": "https://learn.microsoft.com/en-us/visualstudio/releases/2022/release-notes-v17.9",
  "source": "html",
  "body_markdown": "*released Feb 27th, 2024*\n\n### Summary of What's New in this Release of Visual Studio 2022 version 17.9.2\n\n* Fixed an issue that under some conditions, a hang occurs when opening the fonts and colors dialog.\n* A fix was made to prevent a scalar memory load in the inline expansion of the std::round() functions from being changed into a vector access. Although the vector access does not change the result of the computation, it is longer and can fault when the scalar load would succeed.\n* Fixed an issue where in versions of Visual C++ before Visual Studio 2022 version 17.9, the \\_Alignas specifier was not applied correctly according to the ISO-C Standard when it appeared adjacent to a structured type in a declaration.\n\n### Developer Community\n\n* [Multiple Startup Projects Not Saving Configuration and/or crashing Visual Studio](https://developercommunity.visualstudio.com/t/Multiple-Startup-Projects-Not-Saving-Con/10585328)\n\n---",
  "body_html": "<p><em>released Feb 27th, 2024</em></p>\n<h3 id=\"summary-of-whats-new-in-this-release-of-visual-studio-2022-version-1792\">Summary of What's New in this Release of Visual Studio 2022 version 17.9.2</h3>\n<ul>\n<li>Fixed an issue that under some conditions, a hang occurs when opening the fonts and colors dialog.</li>\n<li>A fix was made to prevent a scalar memory load in the inline expansion of the std::round() functions from being changed into a vector access. Although the vector access does not change the result of the computation, it is longer and can fault when the scalar load would succeed.</li>\n<li>Fixed an issue where in versions of Visual C++ before Visual Studio 2022 version 17.9, the _Alignas specifier was not applied correctly according to the ISO-C Standard when it appeared adjacent to a structured type in a declaration.</li>\n</ul>\n<h3 id=\"developer-community-4\">Developer Community</h3>\n<ul>\n<li><a data-linktype=\"external\" href=\"https://developercommunity.visualstudio.com/t/Multiple-Startup-Projects-Not-Saving-Con/10585328\">Multiple Startup Projects Not Saving Configuration and/or crashing Visual Studio</a></li>\n</ul>\n<hr/>",
  "categories": [],
  "copilot_mentions": [],
  "fetched_at": "2026-05-15T18:39:28Z",
  "schema_version": 1
}