{
  "ide": "xcode",
  "version": "0.36.123",
  "release_date": "2025-06-13",
  "title": "Pre-release 0.36.123",
  "url": "https://github.com/github/CopilotForXcode/releases/tag/0.36.123",
  "source": "api_fallback",
  "body_markdown": "Pre-release 0.36.123 of Copilot extension for Xcode",
  "body_html": null,
  "categories": [],
  "copilot_mentions": [
    "Pre-release 0.36.123 of Copilot extension for Xcode"
  ],
  "prerelease": true,
  "fetched_at": "2026-05-12T16:48:39Z",
  "schema_version": 1
}