{
  "ide": "jetbrains",
  "version": "1.5.51",
  "release_date": "2025-07-23",
  "title": "GitHub Copilot for JetBrains 1.5.51",
  "url": "https://plugins.jetbrains.com/plugin/17718-github-copilot/versions",
  "source": "api",
  "body_markdown": "* **Added**: Ability to toggle between the built-in diff view and the modern inline view in both Agent and Edit modes.\n* **Fixed**: Proposed changes in Agent mode now persist correctly after IDE restarts.\n* **Fixed**: Various UI improvements and stability enhancements.",
  "body_html": "<ul><li><strong>Added</strong>: Ability to toggle between the built-in diff view and the modern inline view in both Agent and Edit modes.\n</li><li><strong>Fixed</strong>: Proposed changes in Agent mode now persist correctly after IDE restarts.\n</li><li><strong>Fixed</strong>: Various UI improvements and stability enhancements.</li></ul>",
  "categories": [],
  "copilot_mentions": [
    "* **Added**: Ability to toggle between the built-in diff view and the modern inline view in both Agent and Edit modes.",
    "* **Fixed**: Proposed changes in Agent mode now persist correctly after IDE restarts.",
    "* **Fixed**: Various UI improvements and stability enhancements."
  ],
  "builds": [
    {
      "ide_build": "241",
      "since": "241.0",
      "until": "242.*",
      "compatible_versions": {
        "MPS": "2024.1 — 2024.1.6",
        "PHPSTORM": "2024.1 — 2024.2.6",
        "IDEA_COMMUNITY": "2024.1 — 2024.2.6",
        "GOLAND": "2024.1 — 2024.2.5",
        "PYCHARM": "2024.1 — 2024.2.6",
        "WEBSTORM": "2024.1 — 2024.2.6",
        "CWMGUEST": "build 241.0 — 242.*",
        "RIDER": "2024.1 — 2024.2.9",
        "PYCHARM_COMMUNITY": "2024.1 — 2024.2.6",
        "CLION": "2024.1 — 2024.2.5",
        "DATASPELL": "2024.1 — 2024.2.3",
        "RUST": "2024.1 — 2024.2.5",
        "ANDROID_STUDIO": "Koala | 2024.1.1 — Ladybug Feature Drop | 2024.2.2 Patch 2",
        "JBCLIENT": "build 241.0 — 242.*",
        "DBE": "2024.1 — 2024.2.2",
        "RUBYMINE": "2024.1 — 2024.2.6",
        "IDEA": "2024.1 — 2024.2.6"
      },
      "file_id": 802807,
      "downloads": 431
    },
    {
      "ide_build": "243",
      "since": "243.0",
      "until": "",
      "compatible_versions": {
        "MPS": "2024.3+",
        "PHPSTORM": "2024.3+",
        "IDEA_COMMUNITY": "2024.3+",
        "GOLAND": "2024.3+",
        "PYCHARM": "2024.3+",
        "WEBSTORM": "2024.3+",
        "CWMGUEST": "1.0+",
        "RIDER": "2024.3+",
        "PYCHARM_COMMUNITY": "2024.3+",
        "CLION": "2024.3+",
        "DATASPELL": "2024.3+",
        "RUST": "2024.3+",
        "ANDROID_STUDIO": "Meerkat | 2024.3.1+",
        "JBCLIENT": "1.0+",
        "DBE": "2024.3+",
        "RUBYMINE": "2024.3+",
        "IDEA": "2024.3+"
      },
      "file_id": 802806,
      "downloads": 654
    }
  ],
  "fetched_at": "2026-05-09T09:12:51Z",
  "schema_version": 1
}
