{
  "ide": "copilot-cli",
  "version": "1.0.84-3",
  "release_date": "2026-09-09",
  "title": "1.0.84-3",
  "url": "https://github.com/github/copilot-cli/releases/tag/v1.0.84-3",
  "source": "api",
  "body_markdown": "**Fixed**\n- /copy includes task completion messages when available\n- OAuth-authenticated MCP servers connect reliably during session startup",
  "body_html": null,
  "categories": [],
  "copilot_mentions": [],
  "prerelease": true,
  "fetched_at": "2026-09-11T12:10:10Z",
  "schema_version": 1
}